text,intent
Necesito que se me indique como es puedo solucionar el pronlema con la señal del telefono movil celular Ocurre que en San Bernardo lugar en donde trabajo no tengo señal,Ninguna
uno de ellos el 997300965 no puede hacer llamadas y las cuentas estan pagadas y al dia,Ninguna
Hola sabe qe tengo un saldo vencido en mi plan y no lo abia pagado porque no tenia trabajo pero ahota tengo y me llamaron que tenia descuento para pagar y podia abonar es cierto,Ninguna
Quiero saber si poseo alguna deuda con ustedes,Ninguna
hola buenos dias necesito activar cdf premiun hd pero por telefono no puedo envio mi rut y domicilio favor ver si es posible que quede intalado hoy victor adame roman rut 6089923,Ninguna
active movistar play pero no quiero seguir usandolo De que forma puedo desactivarlo,Ninguna
Quiero saber como activar mi sim,Ninguna
Llamo a 105 desde mi telefono pero no puedo aser llamada porq soy entel en el celu y mi casa tengo internet movistar para eso necesito ayuda de servicio recnico,Ninguna
Hola buenas tardes quisiera saber porque me subio el estado de mi boleta siendo que el mes pasado llame para dar de baja algunos canales y bajar la velocidad del internet y me dijeron que la boleta b,Ninguna
a cual sucursal de valdivia debo llevar mi celular para que lo envien a servicio tecnico,Ninguna
Necesito saber como va mi solicitud de plan con equipo en portabilidad,Ninguna
Hola tengo un problema con la cuenta de uno de los telefonos de mis hijos,Ninguna
Hola se supone que debio haber llegado el tecnico para instalar el servicio de internet s,Ninguna
Pague mi plan y ahora me sale que me conecte a la red movistar y me sale opciones de pre plan,Ninguna
Hola queria consultar si se puede agregar al plan un nuevo equipo,Ninguna
Generar un reclamo,Ninguna
Necesito comprar una bolsa para un telefono pre pago como lo hago,Ninguna
HOla mi numero de cliente es 332 449 049 podrias indicarme con que direccion estoy en su sistema,Ninguna
quiero contratar un plan,Ninguna
Estado de servicio internet hogar,Ninguna
Quiero recargar y me sale un error,Ninguna
Se contrato un sos sin mi autorizacion y ahora no me deja recargar,Ninguna
quiero pagar una deuda atrasada,Ninguna
chip,Ninguna
chip,Ninguna
realice una recarga wwb me desconto el saldo de mi cuenta del banco pero no me aparece la recarga,Ninguna
Quisiera saber si este mes de octubre es mi ultimo mes con Movistar one,Ninguna
he tratado de pagar por todos los medios y no puedo ya que sale sin deuda,Ninguna
hola el dia que cancelo el plan pierdo inmediatamente internet o se demora añgunos dias hasta que se llevan el router,Ninguna
Necesito pedir atorizacion para tener control de mi numero de celular,Ninguna
solicitar permiso para telefono movil,Ninguna
Necvesito cambiar la direccion de mi boleta,Ninguna
hola buenas tardes necesito dar de baja el servicio de Internet hogar,Ninguna
hola como estasn resulta que yo hice la portabilidad con equipo para retiro en tienda y hoy me llamaron que estan haciendo el despacho,Ninguna
Hola necesito saber cua es mi numero ee telefono fijo para poder pagar el internet hogar,Ninguna
contratar,Ninguna
Hola quisiera consultar respecto a cobros de servicios adicionales que aparecen en mi boleta,Ninguna
Hola contrate un plan xxs llego la sim y al instalarla me dice que esta mala,Ninguna
me subieron los megas de internet y me dijeron que era gratis y me estan cobrando la Boleta esta mala,Ninguna
Hola soy cliente movistar y necesito saber si puedo acceder a movistar play,Ninguna
Dice que mi numero telefonico esta asociado a otro usuario,Ninguna
Necesito el numero de la compañia,Ninguna
hola tengo problemas con la compañia no me deja llarmar desde mi celular y yo tengo plan,Ninguna
tengo problemas con mi celular,Ninguna
tengo un plan pero dice que no queda saldo,Ninguna
Por favor me puede indicar el saldo que tengo disponible para ver cuantos minutos he usado,Ninguna
Hoy pague toda la deuda de mi plan y aun no recibo el internet para conectarme,Ninguna
Hola soy Nury Flores titular de la cuenta hogar asignada al numero telefonico 412497339 quiero contratar CDF Premiun para ver el super clasico de mañana,Ninguna
Hola necesito pedir una prorroga,Ninguna
Hola soy Scott okeefe rut 21 926 456 4 y quiero pagar mi t v hogar numero 612412745 Normalmente pago 24 980 pero ahora este mes me salio que debo pagar 26480 porque No ha vencido aun,Ninguna
necesito pagar una deuda atrasado que quedo cuando hice el cambio de portabilidad de el cable que yo tenia,Ninguna
Hola sabes Que me queria portar de prepago a prepago me dijeron que me tenia que comprafcomprar el chip y hacerlo desde la pagina la cual no puedo hacerlo,Ninguna
Hola sabes Que me queria portar de prepago a prepago me dijeron que me tenia que comprafcomprar el chip y hacerlo desde la pagina la cual no puedo hacerlo,Ninguna
Necesito saber como puedo activar mi chip aportandome a prepago,Ninguna
necesito el saber cuanto es de la deuda,Ninguna
Hola sabes Que me queria portar de prepago a prepago me dijeron que me tenia que comprafcomprar el chip y hacerlo desde la pagina la cual no puedo hacerlo,Ninguna
Hola sabes Que me queria portar de prepago a prepago me dijeron que me tenia que comprafcomprar el chip y hacerlo desde la pagina la cual no puedo hacerlo,Ninguna
Hola necesito mi ultima boleta,Ninguna
Necesito dar de baja el servicio hogar,Ninguna
hola quiero revisar mis ultima facturacion line celular 996530767,Ninguna
Tengo duda con el cobro de la boleta,Ninguna
Y me estan cobrando 20990,Ninguna
Hola necesito informacion sobre un despacho,Ninguna
Hola buenas noches queria hacerle una consulta me estan haciendo el cobro de 2 meses que no he usado el internet y esta por encima del precio que yo firme en el contrato Yo contrate un plan de 21990,Ninguna
como pagar el internet de mi departamento,Ninguna
Hola porfavor necesito ayuda pague mi cuenta y aun no me han dado el servicio de hogar,Ninguna
Acabo de portarme a Movistar pero el ship no funciona,Ninguna
no puedo recargar en esta pagina soy de Costa Rica,Ninguna
como puedo repactar mi deuda,Ninguna
No tengo internet wafi,Ninguna
Quiero saber si tengo alguna boleta vensida,Ninguna
Hola esque recarge para comprar algo en un juego y automaticamente se compro un pre plan y me gasto,Ninguna
Carta poder para cambiar equipo,Ninguna
Quiero pagar mi cuenta y no me da la opcion,Ninguna
Quiero pagar en linea,Ninguna
Solo como pagar mi cuenta en linea,Ninguna
Me cortaron mis lineas telefonicas siendo que yo hasta fui a la compañia y me dijeron que no tengo ni una sola deuda,Ninguna
quisiera sacar un servicio ya que tengo tri pack y quiero sacar la lineas de telefono y quedarme solo con television y cable,Ninguna
Quiero reclamar un nro fijo 225540841 Es fono fijo de hogar Estuvieron trabajando en el poste de la calle y desde entonces quedo cortada la linea,Ninguna
Hola queria saber por que en mi ultima boleta me cobran tanto si tenia un plan de 9990 la cuota del telefono de 13,Ninguna
No puedo cambiar el menu en el tv de mi dormitorio,Ninguna
deseo cancelar un servicio de TV,Ninguna
yo no tengo acceso a mi sucursal virtual,Ninguna
como cancelo un servicio desde mi sucursal virtual,Ninguna
deseo cancelar TV,Ninguna
quiero ingresar el codigo de baja de plan,Ninguna
Hola buenos dias queria informar por el pago de una cuenta fija del numero 222791918 por servipag el dia de hoy para q se habilite pronto internet atte gracias,Ninguna
Ya pague quiero habilitacion del servicio,Ninguna
Quiero pagar una deuda y cancelar mi suscripcion a un servicio como lo debo hacer,Ninguna
Puntos movistar,Ninguna
Hola quiero saber si se puede contratar el cdf premium solo por el dia,Ninguna
Hola estoy tratando de pagar mi boleta electronica por internet pero no me deja me pide numero de cliente,Ninguna
Pague hace unos dias mi plan y me dice que tengo duda,Ninguna
Como puedo activar el cdf para hoy,Ninguna
Tengo problemas con la señal de mi celular Dice que sin servicio,Ninguna
No puedo pagar una boleta en linea,Ninguna
acabo de activar movistar play light y no puedo ingresar a cuenta,Ninguna
el numero para contactar a sevivio al cliente desde celullares,Ninguna
Quiero saber como contratar uncanal,Ninguna
No tengo señal en la television,Ninguna
Necesito repactar mi deuda,Ninguna
Tengo problemas con mi telefono me aparece sin servicio y tengo mis cuentas al dia,Ninguna
Necesito cancelar una cuota de 6000 por aceleracion de cuota de mi telefono,Ninguna
Necesito que arreglen el servicio de internet hpgar,Ninguna
Hola quiero cambiar mi fecha de pago de mi servicio movistar hogar,Ninguna
Hola tengo un problemita con el tefono fijo no puedo a tival como lo puedo aser,Ninguna
no se si esta homologado mi celular,Ninguna
esta mi celular homologado,Ninguna
esta mi celular homologado,Ninguna
Hola quiero cerrar mi cuenta de movistar como funciona,Ninguna
Tengo contratado el trio hogar de movistar en basico,Ninguna
quisiera pedir una prorroga en mi telefono bloqueado por imei,Ninguna
Quiero llamar a Movistar por problema de desconexion intermitente de internet,Ninguna
Hola buenas tardes tengo bloqueado mi equipo y quiero pagar pero no me deja tengo el nunero de cuenta como lo puedo hacer,Ninguna
Quiero desbloquear mi equipo,Ninguna
Necesito ver numero de envio,Ninguna
Necesito saber si ya fue despachado mi encargo,Ninguna
Yo tengo el numero de seguimiento y como puedo ver si ya fue despachado,Ninguna
Necesito cambiar la contraseña de mi red wifi,Ninguna
Hola necesito tengo una deuda con ustedes y no quiero perder el plan me gustaria hacer una reparacion,Ninguna
Buenos dias quisiera saber porque no tengo internet,Ninguna
No tengo internet,Ninguna
Digame que me estan cobrando si yo ase como un año que deje de ser plan y soy prepago,Ninguna
Digame que me estan cobrando si yo ase como un año que deje de ser plan y soy prepago Ahora,Ninguna
Teniamos bloqueada la cuenta wifi por no pago,Ninguna
Digame cuanto les debo eso es todo,Ninguna
Solo dime el total de las cuotas del celular para pagarles todo y no me webeen mas,Ninguna
Hola no seas porfiado te estoy diciendo que me diga y cuanto te debo para pagarte y no me wei mas,Ninguna
157433490 ese es mi rut quiero saber por que me bloquearon el celular y el total de la deuda,Ninguna
Valen pico no saben dar una buena respuesta al cliente chao me voy a otra compañia,Ninguna
No debieras ni trabajar ay no tienes ninguna experiencia que pena tu vida,Ninguna
A no y ahora estoy hablando con un fantasma seguro,Ninguna
Tengo mi telefono fijo sin señal,Ninguna
Falla en mi telefono fijo,Ninguna
Me puedes ayudar yo me retire de Movistar y cancele la deuda sin embargo el telefono no me agarra señal con la otra compañia porque sera,Ninguna
el link que me envias de ayuda para entrar a pagar no funciona,Ninguna
Hola yo soy cliente movistar,Ninguna
Soy cliente movistar tengo trio si contrato CDF Hd lo puedo ver en mi pantalla y movistar play,Ninguna
hola necesito bloquear mi celular,Ninguna
Necesito consultas de mi boleta,Ninguna
Hola necesito sacar el seguro por el equipo que me cobran,Ninguna
Hola recien revise mi boleta y descubro que nuevamente me estan cobrando 9990 de Movistar play que yo no contrate y el mes pasado ya me cobraron reclame y vuelve a salir,Ninguna
Pesima compañia que lastima que tenga que ir mañana en persona a resolver esto ya que en 2 meses por telefono me aseguran que si y vuelven a cobrar obviamente aprovechare el viaje y cancelare el plan,Ninguna
Como restablecer mis datos,Ninguna
buenas tardes desea inscribirme en sucursal visrtual u al poner mi numero de documento me dice que no ccoiside con el numero de ru,Ninguna
dame un numero de contacto,Ninguna
Hola buenas noches tengo un problema para comprar en un juego con mi numero tengo plan pero aparte le recargue credito y no me deja dice que me comunique con mi proveedor,Ninguna
Como recargo credito en aple iD desde mi plan o credito disponible,Ninguna
Quiero ingresar forma de pago este celular,Ninguna
Falla internet,Ninguna
Necesito copia de contrato hogar con movistar El n° de cuenta es la 16002059 a nombre de Daniela SAnhueza Vilches,Ninguna
No puedo hacer llamadas,Ninguna
Que necesito para contratar un plan,Ninguna
quisiera saber porque las cuotas de movistar one solo se pueden pagar con tarjeta de credito,Ninguna
Hola buenas puedo redactar mi deuda,Ninguna
Hola escribi el numero de orden para mi despacho y sale que se cancelo la compra,Ninguna
Quiero saber porque se cancelo la entrega de mi pedido,Ninguna
Hola tengo hasta el martes para retirar un equipo nuevo en movistar quiero saber si esta listo para ir mañana,Ninguna
Codigo movistar 130822684A,Ninguna
Hola quiero de suspcribirme de you tube premium y de nexfli por favor no quiero esos servicos por favor,Ninguna
no puedo activar movistar play,Ninguna
telefono con desperfecto sin tono 225528037,Ninguna
Nesecito cambiar el numero telefonico de mi plan,Ninguna
https catalogo movistar cl fullprice catalog product view id 5696 s apple airpods category 17 utm source comparador utm medium knasta utm campaign trafico knasta utm content Apple Airpods contenido,Ninguna
hola quiero cancelar mi contrato de celular,Ninguna
Hola buenas quiero aser un cambio de numero,Ninguna
Por que Mi Movistar dice que mi pan se vuelve a cambiar el 11 10 19,Ninguna
Hola quisiera saber si tienen disponible los airpods en la sucursal de viña,Ninguna
Como saber si hay disponibilidad de un accesorio en una tienda especifica,Ninguna
hola por el plan que tengo y el pais a visitar tengo 10 dias de roaming gratis,Ninguna
Tengo un plan movistar one con un equipo Samsung galaxy s10 el cual ha presentado un daño de fabrica en su boton,Ninguna
requiero cambiar el plan de mi movistar hogar,Ninguna
Hola quisiera saber a que corresponden ciertos cobros de mi boleta,Ninguna
Necesito el detalle de los cobros a que corresponden,Ninguna
Hola no puedo usar mis datos,Ninguna
necesito confirmar el uso de una linea,Ninguna
necesito saber por el estado de un telefono que compre mediante la pagin,Ninguna
Realice una solicitud para portarme desde claro con un equipo y me quedaron de llamar quisiera saber en que va eso,Ninguna
numero de atencion clientes no siento cliente movistar,Ninguna
se me corto el servicio por deuda de una factura,Ninguna
es chiste no puedo pagar,Ninguna
quiero pagar,Ninguna
Cuando va a haber stock disponible del iphone xr 256 GB,Ninguna
stock iphone xr 256 gb,Ninguna
hola quiero consultar por mi estado de despacho,Ninguna
la oficina de apoquindo cual es el numero,Ninguna
tengo un reclamo y necesito hablar con una persona no con un computador y no me da la opcion linda la pagina no sirve,Ninguna
No tengo internet Hogar,Ninguna
quiero hablar con un ejecutivo soy cliente y no tengo contraseña,Ninguna
Hola necisito dar de baja un numero,Ninguna
dar de baja una linea telefonica,Ninguna
QUIERO QUE SE ANULE EL SOS NO SOLICITADO POR MI MOVIL 977182909,Ninguna
NECESITO A UN HUMANO,Ninguna
Una consulta en mi sector estamos sin Internet y telefono,Ninguna
necesito dar de baja un servicio,Ninguna
Hace una dias di de baja,Ninguna
correo al comprar,Ninguna
Nececito ingresar numero de respaldo,Ninguna
no tengo mi orden de compra,Ninguna
Hola consulta llega el internet hogar para la zona de Casablanca en Molina,Ninguna
Contrate un plan la semana pasada y me dijeron que llegaria el chip entre 7 dias habiles y ya pasaron,Ninguna
Como portar un numero prepago,Ninguna
Algun numero de contacto,Ninguna
ASE UNA SEMANA ME INSTALARON EL INTERNET EN CASA,Ninguna
me acabo de comprar un celular via pagina web,Ninguna
necesito saber si es posible realizar el retiro del celular comprado,Ninguna
hola he intentado pagar mi cuenta fija por internet y me arroja error siempre la pagina,Ninguna
Hola me porte desde wom a movistar y mi chip no funciona,Ninguna
Huawei Mate 20 pro black watch3 charger quiero saber si esta en stovk en tiendas movistar,Ninguna
necesito ver la posibilidad de atrasar o repactar un pago,Ninguna
necesito saber como puedo hacer para comprar una bolsa o paquete de internet para un dispositivo movil pero que dure un mes y sea ilimitado el internet,Ninguna
POR FAVOR NECESITO SABER PORQUE LA CUENTA SUBIO DEL Nº,Ninguna
tengo un plan de 14470 por 6 meses ya se culplio ese plan quiero otra promocion,Ninguna
Telefono de contacto,Ninguna
Telefono de contacto,Ninguna
Telefono de contacto,Ninguna
Telefono de contacto,Ninguna
quiero saber que plan es el que tengo,Ninguna
la aplicacion esta mala y quiero saber que plan tengo,Ninguna
Necesito hacer la potabilidad y no se como hacerla,Ninguna
Me bloquearon la tarjeta sim y no puedo recibir llamadas,Ninguna
Cuantas cuotas llevo de mi telefono,Ninguna
no tengo señal de cable,Ninguna
Tengo problemas con el Internet,Ninguna
ayer realice una recarga de celular prepago pero no me cargo el saldo,Ninguna
para contactarme con un ejecutivo,Ninguna
Necesito pagar una cuenta usando un bono telefonico,Ninguna
Porque no tengo cobertura de su compañia,Ninguna
Kie no puedo pasar gigas a mi hija,Ninguna
Pague la cuenta y no tengo cable,Ninguna
Hola buenos dias quiero saber como puedo recargar o comprar bolsa para mi numero que es plan,Ninguna
necesito mi ultima boleta,Ninguna
estoy sin internet,Ninguna
HOLA NO PUEDO REALIZAR LLAMADAS ME PIDEN QUE REGULARICE LA SITUACION LA FACTURA QUE ME RECLAMAN FUE PAGADA EL DIA 10 DE SEPTIEMBRE VENCIA EL 1 DE OCTUBRE FAVOR SOLUCIONAR URGENTE,Ninguna
La cuenta esta sin deuda porque estoy sin servicio,Ninguna
Hola no tengo internet,Ninguna
No tengo deuda en el celular para pagar sin embargo tengo el servicio cortado,Ninguna
Hola mi hija bloqueo mi numero de telefono uds me lo podrian desbloquear,Ninguna
Como desbloqueo mi chip que bloqueo mi hija,Ninguna
EN EL MES DE ABRIL DE ESTE AÑO CONTRATAMOS MOVISTAR HOGAR Y DESDE ESA FECHA QUE LA OTRA EMPRESA ENTEL NOS ESTA COBRANDO CUENTAS POR INTERNET Y TV CABLE NOSOTROS CONTRATAMOS CON USTEDES Y CON PLAN,Ninguna
NO PUEDE SER QUE ME COBREN SE SUPONE QUE USTEDES DEBIAN AVISAR A LA OTRA EMPRESA E RECLAMADO POR TELEFONO Y NO ME DAN SOLUCION,Ninguna
REALICE LA PORTABILIDAD DE 1 LINEA,Ninguna
LA QUIERO ANULAR,Ninguna
buen dia necesito recuperar mi clave de internet por que ya no tengo ni el correo ni el numero de celular en el que estaba registrado,Ninguna
Hola tengo una duda ya que mi boleta hace dos meses aparece por casi 60 000 y yo debiera estar pagando no mas de 35 000 y eso a provocado que me atrase en el pago ya que es muy alto el valor a pagar,Ninguna
quisiera saber si puedo saber el monto de un adelanto de cuotas por el equipo pagarlo por completo,Ninguna
necesito recuperar mi clave de acceso virtual,Ninguna
Quiero saber si sigo con deuda,Ninguna
Hola buenas tardes necesito solicitar reparacion de mi linia telefonica,Ninguna
sin telefonia fija,Ninguna
Quiero saber si mi numero esta activo,Ninguna
Necesito saber en que etapa esta mi pedido del equipo movil,Ninguna
Hola tengo problemas para acceder a Movistar play ya que renove mi cedula de identidad,Ninguna
nesecito pagar un servicio movil,Ninguna
no conosco el numero para poder cancelar e ingrasando mi rut no me aparece,Ninguna
quiero averiguar mi numero virtual,Ninguna
me aparece qeu hice una solicitud de mi internet de hogar y esta solicitud no la he hecho,Ninguna
me aparece qeu hice una solicitud de mi internet de hogar y esta solicitud no la he hecho,Ninguna
quiero anular el servicio de interneet hogar no tengo clave de sucursal,Ninguna
reclamo,Ninguna
Necesito devolver un equipo de internet,Ninguna
Estamos en la undecima region Chile Chico y no tenemos señal,Ninguna
Cuando sCuando se restablece la señal,Ninguna
no hay señal movistar,Ninguna
Necesito renovar mi equipo,Ninguna
Quiero dar de bajar el internet,Ninguna
Quiero dar de bajar el internet,Ninguna
Quiero dar de bajar el internet,Ninguna
Quiero dar de bajar el internet,Ninguna
quiero localizar mi numero,Ninguna
tengo un problema con iphone,Ninguna
como puedo solicitar reparacion de iphone 6s se apago y no prendio mas,Ninguna
Hola buenas tardes Podria ayudarme a que el servio hogar sea retiro ya que me estoy mudando de casa donde se encuentra el servicio,Ninguna
Hola buenas tardes Podria ayudarme a que el servio hogar sea retiro ya que me estoy mudando de casa donde se encuentra el servicio,Ninguna
Como darle debaja a un equipo ya que me mudo,Ninguna
mi modem de internet no me conecta al internet,Ninguna
Buenas tardes nesecito dar de baja el servisio de internet,Ninguna
necesito renunciar linea celular,Ninguna
mi modem no logra conectarse a internet,Ninguna
No tengo la clave,Ninguna
necesito renunciar,Ninguna
La clave para poder ingresar ala paguina,Ninguna
con respecto a los dos celulares que tengo que plan podria tener para rebajar los gastis,Ninguna
Tengo un problema de sonido de iphone,Ninguna
quisiera saber estado de despacho de equipo movil huawei y7 2019 el cual indicaron que llegaria hoy por ser el 6 dia y aun no tengo noticias mi rut es 141521454,Ninguna
Hoy vendria el tecnico,Ninguna
Necesito el numero de call center,Ninguna
Necesito averiguar sobre Internet satelital ya que el sector donde vivo no tiene todavia no hay acceso a Internet por fibra optica o,Ninguna
LOS EQUIPOS IPHONE 6S,Ninguna
La garantia necesariamente necesita presentar un problema no lo puedo cambiar porque quiero hacerlo,Ninguna
LOS EQUIPOS SON NUEVOS,Ninguna
Donde esta la sucursal de las condes,Ninguna
La sucursal donde esta,Ninguna
No quiero pagar,Ninguna
Direccion de sucursal,Ninguna
holaa compre un celular y dice que ya fue entregado pero todavia no ha llegado,Ninguna
Hola buenas queria saber cuando me llega el chip ya que ise,Ninguna
COMO VER LOS PLANES QUIERO CAMBIAR DE PREPAGO A PLAN,Ninguna
Mi internet fibra optica de casa no funciona,Ninguna
Hola favor indicarme a quien le escribo respecto de mi disconformidad con la cuenta de este mes Les llame manifestando que habia tenido intermitencias en el servicio del internet,Ninguna
compre un iphone seminuevo este al llegar fue revisado por lo que su bateria tiene un 87 de desgaste lo lleve a garantia en movistar de huerfanos,Ninguna
Me podrias dar informacion,Ninguna
Quisiera saber como puedo desbloquear mi numero movistar,Ninguna
como cancelar una linea telefonica,Ninguna
Qiero renovar mi equipo y quiero saber qe equipo puedo obtener en mi plan s,Ninguna
No tengo problema por consumo de datos pero no tengo Internet,Ninguna
Hola el internet por fibra que contrate no tiene señal,Ninguna
Cual es mi ultima boleta,Ninguna
Me dieron un beneficio de pago me explico tenia deuda y me llamaron diciendome que si cancelaba en los 2 dias que duraba el beneficio me cobraban la mitad de la deuda total cancele la mitad y no hab,Ninguna
hola que numero debo marcar para que me entreguen informacion sobre el despacho del telefono celular,Ninguna
Buenas tardes se me acabo el plan por un año q tenia con ustedes y la cuenta se me disparo este mes y me es imposible cancelarla solo cuento con lo q pago cada mes,Ninguna
hola compre un telefono supuestamente prepago numero 942676789,Ninguna
Hola desde las 17 00 hrs aproximadamente que no tengo internet en mi hogar,Ninguna
Desde las 17 00 hrs no tengo internet hogar,Ninguna
Me quiero registrar en la app de movistar y el numero de documento no lo puedo poner ya que no me alcanzan los espacios,Ninguna
HOLA DESEO EL DETALLE DE LLAMADAS TELEFONICAS REALIZADAS DESDE EL MES DE JUNIO DE MI NUMERO TELEFONICO,Ninguna
Hola necesito pagar el duo televisor e internet,Ninguna
no puedo navegar,Ninguna
Tengo un problema con la internet de casa,Ninguna
necesito ver el trafico de llamadas del mes de Enero de este año 2019 por favor,Ninguna
Hola hice una recarga con mi saldo y no me llego confirmacion,Ninguna
hace mas de un mes que anule mis lineas de celular Sin embargo recibo mensajes reclamandome un pago por la linea 991873088,Ninguna
telefono de contacto para resolver problemas de facturacion,Ninguna
Hola como dar de baja servicio,Ninguna
necesito ayuda para la suscripccion de mcaffe,Ninguna
Llamadas internacionales,Ninguna
Hola Iba a pagar mi cuenta y me di cuenta que me estan cobrando demas anteriormente pagaba dos numero pero dimos de baja uno de los planes el 10 de septiembre y me lo siguen cobrando completo,Ninguna
Hola quiero saber porque me estan cobrando un monto de 15 349,Ninguna
pague mi cuenta movistar me desconto la plata de mi tarjeta pero en el sistema aparece que no la he pagado,Ninguna
Hola sabe que ise una recarga de 2500,Ninguna
Necesito solicitar una prorroga para mi numero de celular,Ninguna
A que numero puedo llamar para solicitar un prorroga,Ninguna
necesito ver la forma de poder reducir el valor que pago por los servicios fijos,Ninguna
Hola buenas quisiera ver por que no puedo recargar diamantes,Ninguna
Tengo un requerimiento pendiente en instalacion de otro deco en mi domicilio,Ninguna
estoy sin internet,Ninguna
hola necesito la factura del mes para poder cancelar,Ninguna
Quiero dar la baja de los servicios q no da movistar,Ninguna
compre un celular a un tercero y ahora se me bloqueo,Ninguna
consulta en pagina web me aparecio una encuesta de movistar que me ganaba un samsung note 10,Ninguna
Puedo devolver un iPhone,Ninguna
Hola acavo de pagar mi boleta vencida desde este mes y me siguen llegando mensajes de cobro espero respuesta,Ninguna
necesito activar un chip prepago,Ninguna
Desde hace un par de semanas no puedo realizar llamadas,Ninguna
hola estoy tratando de que me regularicen mi cobro desde hace 2 semanas para pode rpagar mi cuenta q vencio el 2 de octubre y aun no me resuelven el problema,Ninguna
estamos sin telefono,Ninguna
necesito por favor contactarme con alguien para abordar problemas con mi cuenta,Ninguna
en el mes de abril me cambie con ustedes y con el paquete portabilidad rollover prepago 100 30 dias ilimitados pero en mi ultima recarga ya no me hicieron valido,Ninguna
Quiero saber el total de mi deuda,Ninguna
HOLA BUENAS TARDES NECESITO HACER CAMBIO DE CLAVE PARA WIFI,Ninguna
