text,intent
estimado el dia de ayer fue pagada uina boleta del numero 968254165 a nombre de carlos aguilar salinas elcual aun continua cortado favor de regularizar el servicio gracias,Ninguna
buenas tardes necesito dar de baja un servicio de triple pack que contrate,Ninguna
quiero que me denel servicio,Ninguna
El numero de mi señora,Ninguna
contrate un plan el cual una operadora me dijo que se contactarian en 48 hrs para hacer la entrega de un celular junto con un chip y asi firmar un contratar correspondiente a portabilidad,Ninguna
Necesito dar la baja alos servicios de internet y telefonia,Ninguna
Roaming,Ninguna
Mensajes de texto en el extranjero,Ninguna
Queria saber como lo puedo hacer para solicitar un cambio de direccion para el internet,Ninguna
quiero dar de baja a cdf,Ninguna
Tome un pequeño plan cambie el chip y quise llamar y no puedo,Ninguna
Se suponia que estaria operativo mi celular en la MAÑANA,Ninguna
mi servicio esta cortado,Ninguna
tengo un plan con ustedes movistar wom pero ya llevo mas de 12 meses y me pidieorn renovar en su momento pero preferi continuar con el equipo,Ninguna
me gustaria conocer el detalle de mi plan,Ninguna
Hola lo que pasa es que yo pago un plan y aun no tengo minutos que puedo hacer si llamo a las sucursales y no contesta nadie,Ninguna
Page la cuenta y aun no me activan el plan,Ninguna
Aun no activan mi linea de,Ninguna
salio una deuda por mi rut 24980338 3 un saldo 29085 pesos,Ninguna
salio una deuda por mi rut 24980338 3 un saldo 29085 pesos,Ninguna
tengp acceso a datos moviles via internet,Ninguna
necesito realizar recarga turbo,Ninguna
area comercial,Ninguna
Desbloquear iphone para uso internacional,Ninguna
Recargue mi celular por su sitio virtual y no me llego la recarga,Ninguna
Hola el 23 de septiembre instalaron internet en mi casa y aun no recibo ninguna cuenta,Ninguna
Pague el plan pero aun no me activan para llamat,Ninguna
Hice una recarga de 1000 y no me llega la recarga,Ninguna
Necesito el numero de cuenta para poder pagar,Ninguna
Me llega una deuda con uds de un numero que nunca saque linea,Ninguna
Quiero saber sobre una deuda vencida de un numero que no conozco,Ninguna
Necesito que alguien me de informacion con respecto a una deuda,Ninguna
Necesito recargar una balsa ami wifi movil,Ninguna
Quiero recuperar mi numero de telefono,Ninguna
Como recargo mi router,Ninguna
queria saber si es posible ver los envios que tengo pendientes,Ninguna
Hola acabo de hacer una recarga a mi movil y no ha llegado la confirmacion,Ninguna
mi pago de mi movil,Ninguna
numero de telefono,Ninguna
quiero el reembolso por un despacho cancelado,Ninguna
Hola necesito saber a que hora cierra la sucursal del Alto las condes y de la dehesa por favor,Ninguna
Quiero mi trio,Ninguna
Me estan llegando facturas de un servicio que ya no uso,Ninguna
y en la mañana pague mi deuda,Ninguna
tengo problemas con mi servicio no puedo recibir mensajes de confirmacion de codigos por ej terceras claves de bancos,Ninguna
telefono para servicio tecnico,Ninguna
Hola tengo un problema cn mi Internet de mi hogar,Ninguna
telefono servicio tecnico telefono fijo,Ninguna
telefono fijo,Ninguna
wifi no funciona,Ninguna
NECESITO SABER CUANTO SALE UN PLAN BASICO SOLO TELEVISION PERO CON DOS DECOS,Ninguna
Hola mira cancele mi plan y no tengo servicio aun,Ninguna
Pague mi plan y no me ha llegado el servicio aun,Ninguna
Necesito dar de baja el Internet llame a movistar recien y la srta me dijo que para poder hacerlo lo hiciera virtual,Ninguna
quisiera saber como puedo hacer para renunciar a mi plan de internet hogar,Ninguna
aun no me a llegado un celular que compre y coloco para ver el seguimiento con la orden de compra,Ninguna
necesito poner una solicitud,Ninguna
necesito poner una solicitud,Ninguna
mi producto aun no llega y en la paginame meto para revisar el estado de despacho pero me dice que el numero no existe,Ninguna
no me ha llegado mi producto y no aparece el seguimiento de despacho,Ninguna
Cuando me bloquean el telefono por mora una vez pagado cuanto se demora en desbloquearlo,Ninguna
Necesito desactivar mi plan,Ninguna
el dia martes intente hacer la compra de un equipo por la pagina y la compra resulto rechazada Pero luego revisando mi cuenta veo que se realizo el cobro a mi TDC,Ninguna
Nesesito un proroga hasta el dia 20 del presente mes ya que temas del pais no me canselando mi pago en mi travajo x lo tanto estoy atrasado en mi pago,Ninguna
Nesesito un proroga de pago hasta el dia 20 del presente mes,Ninguna
Que me estan enviando correos electronicos para dar aviso del pago de cuenta Telefonica y yo no soy la persona al cual ustedes su empresa tiene que cobrar,Ninguna
Hace unas semanas anule el internet con numero 412612299,Ninguna
Anule un servicio de internet y hoy me llego una boleta de cobro de,Ninguna
Me gustaria saver el estado de los servidores de movistar en chile,Ninguna
Sabe que me bloquearon mi equipo por mora,Ninguna
Quiero saber mi deuda,Ninguna
Hace un tiempo saque un plan en Movistar con equipo a costo cero,Ninguna
Quiero avisar de un pago realizado,Ninguna
Hola tengo un problema con la coneccion de internet,Ninguna
hogar,Ninguna
Hola buenas tardes quisiera saber porque mi boleta de television salio mas de lo acordado debido a que mi monto a cancelar es de 22990 y me salio por un monto de 26490,Ninguna
Hola me llego mail de aviso suspension de servicio pero cancele la cuenta ayer 13 de nov,Ninguna
La cuenta esta pagada ingrese a pagar y dice no tiene deuda,Ninguna
Quiero que revisen mi cuenta del numero 71 2272457 que esta pagada ayer 13 de noviembre y me llego mail de aviso de corte de servicio y no corresponde,Ninguna
necesito dar de baja una linea de telefono,Ninguna
Necesito saber por que mi cuenta aumento a 40 mil desde el mes pasado,Ninguna
buenas tardes tengo una consulta realice la portabilidad de mi numero fijo y el mes pasado me llego la boleta para cancelar al tratar de efectuar el pago en linea no me dejo efectuarlo,Ninguna
contrate un servicio por telefono y lo quiero eliminar o saber mas acerca de eso,Ninguna
movistar on para iphone 11,Ninguna
hoy realize una carga a mi celular por 5000 no fue agrgada a mi celular pero si fue descontada,Ninguna
Hola quiero saber q si doy de baja un plan puedo seguir pagando la cuota para q n me blokeen el equipo,Ninguna
que es servicio hogar,Ninguna
Hola soy jessica tengo una deuda con movistar pero no puedo pagar el total k facilidades me pueden dar,Ninguna
Necesito aclarar un cobro adicional que estan aplicando a mi boleta,Ninguna
Necesito saber mi numero de telefono,Ninguna
me estan cobrado una boleta pagada,Ninguna
Necesito que me envien la ultima boleta por favor,Ninguna
Necesito habilitar chip,Ninguna
Y necesito que me la envien para poder pagar,Ninguna
Hola hice un plan de pago hace como 2 horas me pidieron que pagara un pie de 24 000 lo cual lo realice a traves de servipag pero aun no me llega el servicio,Ninguna
Hola hice un plan de pago hace como 2 horas me pidieron que pagara un pie de 24 000 lo cual lo realice a traves de servipag pero aun no me llega el servicio,Ninguna
Hola hice un plan de pago hace como 2 horas me pidieron que pagara un pie de 24 000 lo cual lo realice a traves de servipag pero aun no me llega el servicio,Ninguna
Hola hice un plan de pago hace como 2 horas me pidieron que pagara un pie de 24 000 lo cual lo realice a traves de servipag pero aun no me llega el servicio,Ninguna
buenas tardes estoy tratando de pagar mi cuenta fija empresa y no veo los medios de pago acostumbrados,Ninguna
quisiera saber sobre un telefono que tienen en venta,Ninguna
necesito saber a que hora me reponen el servicio que pague hace un rato atras,Ninguna
quisiera pagar una boleta adicional,Ninguna
Quiero dar de baja la television por cable,Ninguna
Es que mi pareja pago su plan y no le a llegado el mensaje de activacion,Ninguna
Hola sabes quiero saber aca en Pudahuel estamos sin linea telefonica ni wifi,Ninguna
ingreso a plataforma Seguimiento de solicitud de Servicio Fijo,Ninguna
Necesito saber que deuda tengo en su sistema,Ninguna
cual es la totalidad de mu deuda,Ninguna
No se mi numero se me perdio para cargarlo,Ninguna
Hola por equivocacion pague dos veces una cuenta Queria saber si se puede reembolsar o dejar para el pago del mes siguiente gracias,Ninguna
mi ultima boleta contiene un error,Ninguna
Como apagar el TV,Ninguna
quiero saber porque me subieron el costo de datos moviles,Ninguna
tengo un plan de 6 990 pesos y quiero comprar una aplicacion por la facturacion de Movistar pero no me lo permite que puedo hacer,Ninguna
Necesito el numero,Ninguna
Hola necesito dar de baja el servicio ya que me cambie de dlmicilio y al pedir el cambio de domicilio de los servicios me informaron que mi nuevo domicilio no contaba con factibilidad tecnica,Ninguna
Me cortaron el servicio por motivo desconocido,Ninguna
Hola me cobraron demas en mi boleta,Ninguna
como reclamo por cobro indebido,Ninguna
Hola necesito que me aclaren por que mi cuenta de este mes es mas cara a lo habitual,Ninguna
necesito terminar contrato con una linea de banda ancha movil,Ninguna
Tengo una linea Movistar que no he podido usar porque cada vez que intento llamar me manda un mensaje donde dice,Ninguna
entregar servicio internet,Ninguna
Quiero dar de baja,Ninguna
Mi deuda,Ninguna
Donde puedo dar de baja un servicio,Ninguna
Necesito dar de baja un servicio,Ninguna
Necesito saber el costo por Minuto por ocupar el Carrier y llamar al extranjero,Ninguna
Hola saves e trataso de comprar contenidos de pay story y me sale qe e superado mi maximo de compras asta el otro mes,Ninguna
Yo soy prepago como me puedo portar,Ninguna
Hola necesito saber el consumo de mis minutos hogar,Ninguna
quiero saber si hay un mejor pack para mi,Ninguna
Contrate un plan con ustedes recientemente y no me dice que el chip tiene problemas y que lo cambie,Ninguna
Un telefono,Ninguna
Por que me estan cobrando un mes de plan que no ocupe,Ninguna
Hola me dijeron que uno podia pagar la cuenta de Spotify en la cuenta de Movistar es posible,Ninguna
Quisiera saber como cancelar mi plan de television e internet hogar,Ninguna
Hola compre un celular via callcenter esta en proceso de despacho y no se han comunicado conmigo al ubicarlo online dice que se ha cancelado mi despacho,Ninguna
hola mira sabes ase meses que estoy renunciamdo a 1 bolsas de millas de mi plan que por x motivos me cobrar ase varios meses ya estoy muy molesta porque es 1 estafa que cada mes me cobren 2000 dema,Ninguna
Quisiera ingresar un reclamo pues mi servicio de Internet hogar no funciona hace varios dias,Ninguna
Quiero ingresar un reclamo por esta via porque el numero 105 esta constantemente ocupado,Ninguna
reclamo,Ninguna
Necesito bajar mi plan,Ninguna
Buenos dias ayer realice una solicitud de baja de plan y debo enviar imagen de carne de identidad por medio de sucursal virtual y la pagina indica error no tengo tiempo de ir personalmente a la su,Ninguna
No Solo quiero que me den una explicacion Me Tuvieron tres Semanas asin Servicio Y me Atraso una Semana en pagar la Cuenta y Me Cortan los Servicios Perdoname pero Son muy Cara de raja,Ninguna
Hola necesito saber si puedo prorrogar el pago de la boleta tengo el servicio cortado y puedo cancelar el 20,Ninguna
Necesito saber cuanto se demoran en reponer el servicio de tv,Ninguna
hola me gustaria solicitar una prorroga a mi celular,Ninguna
necesito una prorroga,Ninguna
no puedo cambiar la contraseña de mi cuenta en movistar play,Ninguna
HOLA SABES QUE ME CORTARON EL CELULAR Y TENGO EL COMPROBANTE DE PAGO,Ninguna
Hola me encuentro en el extranjero recargue mi numero con 23000 pesos para poder activar roaming internacional y al llegar a Brazil mi telefono no se conecta a ninguna red,Ninguna
despacho,Ninguna
quisiera pedir una prorroga,Ninguna
Hola tengo cortado el servicio y esta pagado,Ninguna
Hola quiero saber si hay alguna forma de que pedir un echip de manera online,Ninguna
no puedo pagar en linea la cuenta vencida de mi celular,Ninguna
ayer cancelamos una cuenta de movistar hogar,Ninguna
me cortaron el servicio por no pago,Ninguna
Yo tengo un plan con usd,Ninguna
quisiera saber si puedo solicitar una prorroga para mi numero,Ninguna
comprobantes de pago,Ninguna
se puede retirar un celular en la sucursal si lo compre por internet,Ninguna
costos de boleta,Ninguna
Necesito pagar mi cuenta vencida pero ya me aparece otra cuenta cobrada y aun no vencida,Ninguna
necesito pagar la cuenta del telefono pero al ingresar a la pagina y marcar pagar no me permite acceder,Ninguna
necesito dar de baja mis servicios,Ninguna
Quisiera una prorroga de pago,Ninguna
Solicite un equipo con portabilidad con retiro en huerfanos hay posibilidad de hacer el cambio y me lo envien a mi casa,Ninguna
hace un rato llame a soporte tecnico de Movistar para solicitar una prorroga y aun no se vuelve a activar el cable ni interner,Ninguna
quiero cancelar que hago,Ninguna
En la boleta aparece un item servicio adicional de televion,Ninguna
Tengo un reclamo,Ninguna
Tengo un plan y me habia estado funcionando bien,Ninguna
tengo el cel cortado por que se me olvido pafgar realice el pago por intermedio de mi banco hace una hora pero aun no me activan el telefono,Ninguna
Necesito saber si la promocion de las redes solo se utiliza cuando hay gigas,Ninguna
No puedo recargar mi numero prepago por Internet,Ninguna
Intente recargar con mi numero prepago y no puedo,Ninguna
Buenos dias sabes yo era cliente Movistar en este numero y saque un huawei p 30 lite pero hace como 3 meses aproximado me porte a claro y ahora el equipo no me toma el chip de la otra compañia,Ninguna
necesito saber porque no puedo pedir prorroga,Ninguna
Estimada me estan cobrando la factura de este mes que comprende el periodo del 6 de octubre al 7 de noviembre y di de baja mo servicio a partir del 9 de octubre con quien me tengo que contactar para,Ninguna
un numero para contactarme ya que quiero cambiar de plan,Ninguna
Buenos dias a que hora mas o menos me dan mi telefono,Ninguna
hola queria saber si en la sucursal del parque arauco pudeo hacer renovacion de mi equipo celualr,Ninguna
Hola Quiero quitar un canal de mi plan de cable,Ninguna
si me dueda de consumo,Ninguna
hola soy rodrigo Acabo de pagar cuenta movil se realizo transicion bancaria pero todavia salgo con deuda pendiente,Ninguna
Ejecutivo de cobranza,Ninguna
cual es el numero de atencion para clientes de otra compañia,Ninguna
Hola buenos dias yo realice el pago de mi cuenta y me descontaron el dinero de mi cuenta y en aun sale que debo en sistema,Ninguna
hola que sucursales en las condes estan abiertas para cambiar equipo por una empresa,Ninguna
una consulta tenia mi plan de celular cortado que vencio el dia 9 de este mes pero ya esta pagado,Ninguna
y quiero dar aviso que estare en Mexico usando los 15 dias de roaming,Ninguna
Activar Mensajes de texto roaming,Ninguna
necesito pedir una prorroga de mi numero de empresas,Ninguna
Yo estare un mes fuera de Chile por lo tanto quiero activar el roaming solo durante 15 dias cuando no tenga acceso a internet Ademas de descontar el Roaming debo desconectar los datos moviles,Ninguna
necesito el mumero de movistar empresas para pedir una prorroga,Ninguna
para pedir una renovacion de chip tiene que hacerlo el titular de la cuenta,Ninguna
necesito hacer una prorroga mandame un telefono ya que los que me envio son para personas y necesito para empresas,Ninguna
quiero contratar movistar one,Ninguna
El Internet no funciona,Ninguna
Cuotas pagadas de mi equipo,Ninguna
soy clientey quiero cambiar mi plan a uno mas economico,Ninguna
Pagar equipo,Ninguna
Deuda movistar,Ninguna
Hola requiero saber si cuentan con servicio tecnico en alguna sucursal de Concepcion,Ninguna
necesito aclarar una duda respecto al cobro de mi cuenta actual,Ninguna
Se me hecho a perder mi chip y necesito uno nuevo pero lo va a retirar una prima,Ninguna
necesito pagar cuenta internet hogar y no puedo hacerlo en la sucursal virtal,Ninguna
Buenos diias solicito orientacion para cambio de fecha de pago,Ninguna
necesito cambiar la fecha e pago de mi cuenta,Ninguna
una consulta estoy actualmente sin datos y el plan que tengo es datos ilimitados,Ninguna
hola di de baja el plan hogar en junio o julio ya devolvi los equipos la deuda sigue subiendo que puedo hacer,Ninguna
area comercial,Ninguna
area comercial,Ninguna
favor habilitar N°992254229 en nuevo celular,Ninguna
tengo dudas con mi boleta,Ninguna
Hola buenas tardes mire tengo una deuda de 66 en movistar,Ninguna
Quisiera saber hasta cuando debo pagar mi equipo movistar,Ninguna
Hola necesito pagar mi plan y me sale que el rut y el numero de movil no tienen plan en Movistar no entiendo,Ninguna
Necesito poder pagar mi plan pero en linea me sale que no tengo plan en movistar,Ninguna
como puedo ver el detalle del trafico de llamadas desde mi sucursal virtual,Ninguna
como puedo saber el stock disponible de equipos de oulet en una tienda especifica,Ninguna
saber porque se cae la señal acada rato el wifi nesecito que me solucionarme el problema si no para cancelar el servicio yaque hace 3 dias,Ninguna
he intentado pagar mi cuenta 2 veces y no he podido me arroga error pero si me realiza el descuento de mi cuenta corriente,Ninguna
Hola ayer se pago mi cuenta telefonica y aun no se me repone el servicio,Ninguna
Quiero dar de baja 2 televisores porque hace 45 dias no tengo cable motivo construccion de la casa y no hay donde poner la antena satelital,Ninguna
bloqueo por imei,Ninguna
holnecesito pagar una cuenta atrasada,Ninguna
Me puede enviar mu ultima boleta porfavor,Ninguna
Tengo una consulta respecto al plan internet hogar que tengo en casa,Ninguna
Nesecito detalle de servicios de consumo de tv hogar,Ninguna
Ver detalles decargos adicionales de mi boleta hogar,Ninguna
mi internet no funciona,Ninguna
Internet hogar sin señal,Ninguna
Ver q cargos adicionales de mi boleta,Ninguna
Como se puede reparar la conexion de internet hogar,Ninguna
buenas tardes quisiera saber,Ninguna
por telefono para decir,Ninguna
quisiera saber porque no han descontado el plan para pagar la cual no he podido ocupar el rouster,Ninguna
Hola quiero saber por que no tengo internet hogar,Ninguna
No me deja comprar una cosa en un juego con la facturacion y me dice que he exedido el saldo y yo no he comprado nada este mes,Ninguna
cada vez que quiero comprar un telefono movil que esta en oferta,Ninguna
Me cortaron el servicio y no me dejan pedir una prorroga,Ninguna
Hola me gustaria comprar un equipo pero sale sin stock quiero saber si tambien se encuentra disponible en tienda y al mismo valor,Ninguna
tengo casi dos años con movistar one el primer año renove el equipo y quiero saber cuanto tiempo debe pasar para que pueda cambiar el plan que tengo,Ninguna
quiero saber por cuanto tiempo contrate mi plan,Ninguna
Hola buenas necesito saber porq no se hizo el pago de mi boleta,Ninguna
problemas chip,Ninguna
como puedo cambiar un chip,Ninguna
Hola hace como 1 mes he tenido problemas con el microfono de mi celular a mi me escuchan cuando me llaman pero ellos no me pueden escuchar nada,Ninguna
hola necesito saber si la sucursal de apoquindo 3500 su horario de atencion hoy viernes 15 de noviembre,Ninguna
Necesito saber si me pueden arreglar mi celular,Ninguna
di de baja un servicio el 24 10 2019 pero me estan cobrando la boleta completa del mes,Ninguna
Necesito ayuda sobre una recarga realizada hacr una semana,Ninguna
Necesito ayuda por una recarga,Ninguna
Porque pasa es que tengo una cuenta por pagar,Ninguna
Quiero repactar mi deuda,Ninguna
Quiero repactar mi deuda,Ninguna
Me cortaron hace un rato el telefono teniendo vigente una concedida por ustedes para el dia 20 de noviembre Que flaseriedad enlos servicios,Ninguna
Cuando reanudan mi servicio,Ninguna
me robaron el celular y quiero bloquearlo,Ninguna
Sobre un pago que nunca supe que existia,Ninguna
El otro dia paso un camion y corto los cables y me dejo sin Internet pero no corto el tv cable intente comunicarme con el servicio tecnico y no pude mis datos son Eduardo Avendaño Rut 6435716 6,Ninguna
Hola buen dia quisiera saber si puedo modificar mi plan de el movil,Ninguna
quiero pagar unas facturas pendientes del 323603353 y me dice que no tengo deuda pendiente pero me aparecen como morocidad en el sistema financiero,Ninguna
No funciona el deco,Ninguna
buenas sabes que el dia de hoy amaneci sin servicio de interenet,Ninguna
hola soy de punta arenas y soy cliente y necesito mover de lugar el router,Ninguna
Necesito contactarme con Movistar,Ninguna
Quiero saber el porque si ya pague mi boleto porque no tengo para hacer llamadas,Ninguna
Hola necesito activar mi chip,Ninguna
Me porte a movistar y todavia no puedo hacer la activacion de mi prepago,Ninguna
Yo me porte a Movistar y no puedo activar el chip,Ninguna
COMO PUEDO PEDIR UNA PRORROGA,Ninguna
Quiero saber si finalmente es posible que vengan a realizar la instalacion del servicio hoy,Ninguna
tengo un problema de corte de señal,Ninguna
Necesito un ejecutivo,Ninguna
Hola soy Victor Espinoza tengo problemas con el internet de mi casa,Ninguna
Cual es el numero para llamar desde un celular de otra compañia,Ninguna
Hola Pague mi cuenta ayer a traves de Sevipag y resulta que en la noche me cortaron el cable El Nº asociado de telefono fijo es 671 68 22,Ninguna
Buenas tardes Boleta Hogar Folio 130627601 Fecha de vencimiento 30 11 2019 Cuenta 001444506 Telefono 512345343 Se me ofrecio un descuento por 6 meses asociado a este numero y lamentablemente no,Ninguna
necesito recuperar un pago por compra de equipo,Ninguna
Hola buenas tardes necesito saber el porque mi boleta ha subido tanto por favor necesito alguna respuesta,Ninguna
Pague en la mañana el cable e internet,Ninguna
No quiero interactuar con ustedes quiero que me expliquen el por que del alza de mi boleta,Ninguna
cuando inicia el plan ya que al parecer consumio los gb,Ninguna
Que me den el cable,Ninguna
Para llamar y que me repongan el servicio,Ninguna
hola necesito ayuda ya que mi movil esta sin servicio y esta la cuenta al dia,Ninguna
Hola no puedo configurar smart wifi me sale que estoy conectado a una red que no es compatible,Ninguna
Acabo de quedar sin servicio de cable,Ninguna
Hola contrate una bolsa se internet por 3 dias de roaming,Ninguna
Se cayo el sistema movistar,Ninguna
Estaba viendo television y de repente sale que no hay señal que hago,Ninguna
No me han activado mi portabilidad,Ninguna
Que hago sale que no hay señal,Ninguna
Se quedo pegado el deco,Ninguna
hola estoy con problemas con el televisor no se porque me pide el pin del operador y no se cual es,Ninguna
Por que mi televisor no funciona y no contastan los telefono,Ninguna
Se me fue la señal del cable,Ninguna
Porqe se fue la señal del cable,Ninguna
tengo pegados los canales nacionales,Ninguna
Quisiera en saber en que consite mi plan que tengo,Ninguna
No tengo cable de canales nacionales,Ninguna
buenas tardes necesito hacer un requerimiento por el plan del hogar,Ninguna
queria saber sobre la conexion en limache,Ninguna
acabo de cancelar mi deuda y aun no me activan el servicio,Ninguna
cuando reponen el servicio ya pagado,Ninguna
Quiero exigir un servicio como corresponde no logro tener señal en mi casa e internet,Ninguna
Quiero saber por que no se me ven los canales nacionales,Ninguna
Tengo un problema mi papa el dia domingo realizo el pago de su plan y segun movistar no se realizo el pago entonces se pago de otra cuenta y al otro dia el anco figuro el descuento del pago,Ninguna
me gustaria si me pidiera ver mi numero 989699092,Ninguna
Estoy sin servicio de tv por casi 1 hora y no puedo llamar al servicio tecnico desde mi numero de red fija porque tambien esta cortado el servicio,Ninguna
Estoy sin servicio de tv por casi 1 hora y no puedo llamar al servicio tecnico desde mi numero de red fija porque tambien esta cortado el servicio,Ninguna
Esta sin servicio,Ninguna
Estoy sin servicio de tv por casi 1 hora y no puedo llamar al servicio tecnico desde mi numero de red fija porque tambien esta cortado el servicio,Ninguna
Estoy sin servicio de tv por casi 1 hora y no puedo llamar al servicio tecnico desde mi numero de red fija porque tambien esta cortado el servicio,Ninguna
Estoy sin servicio de tv por casi 1 hora y no puedo llamar al servicio tecnico desde mi numero de red fija porque tambien esta cortado el servicio,Ninguna
Estoy sin servicio de tv por casi 1 hora y no puedo llamar al servicio tecnico desde mi numero de red fija porque tambien esta cortado el servicio,Ninguna
No hay señal en canales,Ninguna
quisiera preguntar por mi saldo telefonico,Ninguna
Hola mi boleta se encuentra vencida pero ayer llame para pedir una prorroga y me la aceptaron el problema es que acabo de quedarme sin señal,Ninguna
Ola buenas quisiera saber como puedo pedir APN de Movistar,Ninguna
989699092 Ola soy anyello este es mi numero y esta sin servicio me podria decir el porque y como puedo solucionarlo por favor,Ninguna
No puedo llamar q mal servicio,Ninguna
No funciona mi internet hogar hace dos dias que puedo hacer,Ninguna
Hola estoy sin internet y cable a medias Donde llamo numero ya que mi movil no es movistar por lo que el 0911 no existe,Ninguna
Quedaron en llevar un tecnico a mi hogar a las 4 pero aun no llama ni llega nadie que puedo hacer,Ninguna
En mis casa tenemos el servicio TRIO pero este no esta funcionando,Ninguna
Ingrese una opcion y son dos,Ninguna
Dime si contestan Necesito revision internet y cable No tengo y la cuenta esta pagada,Ninguna
tecomento que no tengo algunos canales de TV para visualizar,Ninguna
No tengo canales nacionales se quedo pegado la tele,Ninguna
necesito que desde el sistema remoto arreglen la falla de visualizacion de los canales,Ninguna
Mi internet esta muy mal,Ninguna
Cual es el numero de atencion al cliente hogar desde otras compañias Ahora,Ninguna
Acabo de pagar la boleta por el internet que tengo en donde vivo pero sigue apareciendo la deuda la pagina tiene retrasos con los pagos,Ninguna
no funciona los canales nacionales,Ninguna
